[
  {
    "id": "a1f7ac27-881a-4f0f-b595-f8f614ebf001",
    "clientId": "CLI-001",
    "clientName": "Clinica Santa Elisa",
    "location": {
      "address": "Av. Reforma 220, CDMX",
      "gps": {
        "lat": 19.4326,
        "lng": -99.1332
      }
    },
    "assignedTechnician": "Carlos Nu√±ez",
    "pestType": "Cucaracha",
    "infestationLevel": "alto",
    "chemicalsUsed": [
      {
        "id": "CHEM-005",
        "name": "Gel Imidacloprid 2.15%",
        "activeIngredient": "Imidacloprid",
        "sanitaryRegistry": "RSCO-URB-INAC-1001-301-001-2.15",
        "dosisPorLitro": 2,
        "dosisUnidad": "gr",
        "tiempoReingreso": 3,
        "cantidadAplicada": 120,
        "dilucion": "2 gr/L",
        "lote": "IMI-2402-A",
        "areaM2": 480,
        "tankLiters": null
      }
    ],
    "applicationDate": "2026-02-10",
    "nextVisitDate": "2026-03-10",
    "status": "completado",
    "serviceNotes": "Control intensivo en area de cocina y bodegas.",
    "certificate": {
      "issued": false,
      "issuedAt": null,
      "folio": null
    },
    "createdAt": "2026-02-09T14:20:00.000Z",
    "updatedAt": "2026-02-10T18:00:00.000Z"
  },
  {
    "id": "a1f7ac27-881a-4f0f-b595-f8f614ebf002",
    "clientId": "CLI-001",
    "clientName": "Clinica Santa Elisa",
    "location": {
      "address": "Av. Reforma 220, CDMX",
      "gps": {
        "lat": 19.4326,
        "lng": -99.1332
      }
    },
    "assignedTechnician": "Ana Prado",
    "pestType": "Roedor",
    "infestationLevel": "medio",
    "chemicalsUsed": [
      {
        "id": "CHEM-003",
        "name": "Bromadiolona 0.005%",
        "activeIngredient": "Bromadiolona",
        "sanitaryRegistry": "RSCO-URB-RODE-2188-401-014-0.005",
        "dosisPorLitro": 3,
        "dosisUnidad": "gr",
        "tiempoReingreso": 2,
        "cantidadAplicada": 30,
        "dilucion": "3 gr/L",
        "lote": "BRO-2402-C",
        "areaM2": null,
        "tankLiters": 10
      }
    ],
    "applicationDate": "2026-02-20",
    "nextVisitDate": "2026-03-20",
    "status": "programado",
    "serviceNotes": "Inspeccion y reposicion de cebaderos en perimetro.",
    "certificate": {
      "issued": false,
      "issuedAt": null,
      "folio": null
    },
    "createdAt": "2026-02-15T10:00:00.000Z",
    "updatedAt": "2026-02-15T10:00:00.000Z"
  },
  {
    "id": "a1f7ac27-881a-4f0f-b595-f8f614ebf003",
    "clientId": "CLI-002",
    "clientName": "Restaurante Bahia Verde",
    "location": {
      "address": "Calle 8 #113, Merida",
      "gps": {
        "lat": 20.9674,
        "lng": -89.5926
      }
    },
    "assignedTechnician": "Marco Vega",
    "pestType": "Mosquito",
    "infestationLevel": "bajo",
    "chemicalsUsed": [
      {
        "id": "CHEM-004",
        "name": "Permetrina 25%",
        "activeIngredient": "Permetrina",
        "sanitaryRegistry": "RSCO-PEC-INAC-0900-064-020-25",
        "dosisPorLitro": 0.6,
        "dosisUnidad": "ml",
        "tiempoReingreso": 8,
        "cantidadAplicada": 250,
        "dilucion": "0.6 ml/L",
        "lote": "PER-2401-B",
        "areaM2": 4200,
        "tankLiters": null
      }
    ],
    "applicationDate": "2026-02-18",
    "nextVisitDate": "2026-03-18",
    "status": "completado",
    "serviceNotes": "Nebulizacion nocturna en patio y drenaje.",
    "certificate": {
      "issued": true,
      "issuedAt": "2026-02-19T11:30:00.000Z",
      "folio": "DES-2026-523901"
    },
    "createdAt": "2026-02-16T08:10:00.000Z",
    "updatedAt": "2026-02-19T11:30:00.000Z"
  }
]
